{
  "$schema": "https://json-schema.org/draft/2020-12/schema",
  "name": "contextualization_update",
  "type": "object",
  "additionalProperties": false,
  "required": [
    "contextualization_id",
    "document_id",
    "source_annotation_id",
    "language",
    "change_contextualizations",
    "merge_summary"
  ],
  "properties": {
    "contextualization_id": {
      "type": "string"
    },
    "document_id": {
      "type": "string"
    },
    "source_annotation_id": {
      "type": "string"
    },
    "language": {
      "type": "string",
      "enum": [
        "it"
      ]
    },
    "change_contextualizations": {
      "type": "array",
      "items": {
        "type": "object",
        "additionalProperties": false,
        "required": [
          "change_id",
          "cybersecurity_relevance",
          "relevance_rationale",
          "classe",
          "priority",
          "framework_mappings",
          "prototype_actions",
          "control_actions",
          "notes"
        ],
        "properties": {
          "change_id": {
            "type": "string",
            "enum": [
              "change_003_interface_change_deadline"
            ]
          },
          "cybersecurity_relevance": {
            "type": "string",
            "enum": [
              "relevant",
              "not_relevant",
              "uncertain"
            ]
          },
          "relevance_rationale": {
            "type": "string"
          },
          "classe": {
            "type": "string",
            "enum": [
              "Obbligatoria",
              "Consigliata",
              "Facoltativa",
              "Non applicabile",
              "Da verificare"
            ]
          },
          "priority": {
            "type": "string",
            "enum": [
              "ALTA",
              "MEDIA",
              "BASSA",
              "Non applicabile",
              "Da verificare"
            ]
          },
          "framework_mappings": {
            "type": "array",
            "items": {
              "type": "object",
              "additionalProperties": false,
              "required": [
                "subcategory_id",
                "subcategory_text",
                "mapping_weight",
                "rationale"
              ],
              "properties": {
                "subcategory_id": {
                  "type": "string",
                  "enum": [
                    "DE.AE-01",
                    "DE.AE-02",
                    "DE.AE-03",
                    "DE.AE-04",
                    "DE.AE-05",
                    "DE.CM-01",
                    "DE.CM-02",
                    "DE.CM-03",
                    "DE.CM-04",
                    "DE.CM-05",
                    "DE.CM-06",
                    "DE.CM-07",
                    "DE.CM-08",
                    "DE.DP-01",
                    "DE.DP-02",
                    "DE.DP-03",
                    "DE.DP-04",
                    "DE.DP-05",
                    "DP-ID.AM-07",
                    "DP-ID.AM-08",
                    "DP-ID.DM-01",
                    "DP-ID.DM-02",
                    "DP-ID.DM-03",
                    "DP-ID.DM-04",
                    "DP-ID.DM-05",
                    "DP-ID.RA-07",
                    "DP-RS.CO-06",
                    "ID.AM-01",
                    "ID.AM-02",
                    "ID.AM-03",
                    "ID.AM-04",
                    "ID.AM-05",
                    "ID.AM-06",
                    "ID.BE-01",
                    "ID.BE-02",
                    "ID.BE-03",
                    "ID.BE-04",
                    "ID.BE-05",
                    "ID.GV-01",
                    "ID.GV-02",
                    "ID.GV-03",
                    "ID.GV-04",
                    "ID.RA-01",
                    "ID.RA-02",
                    "ID.RA-03",
                    "ID.RA-04",
                    "ID.RA-05",
                    "ID.RA-06",
                    "ID.RM-01",
                    "ID.RM-02",
                    "ID.RM-03",
                    "ID.SC-01",
                    "ID.SC-02",
                    "ID.SC-03",
                    "ID.SC-04",
                    "ID.SC-05",
                    "PR.AC-01",
                    "PR.AC-02",
                    "PR.AC-03",
                    "PR.AC-04",
                    "PR.AC-05",
                    "PR.AC-06",
                    "PR.AC-07",
                    "PR.AT-01",
                    "PR.AT-02",
                    "PR.AT-03",
                    "PR.AT-04",
                    "PR.AT-05",
                    "PR.DS-01",
                    "PR.DS-02",
                    "PR.DS-03",
                    "PR.DS-04",
                    "PR.DS-05",
                    "PR.DS-06",
                    "PR.DS-07",
                    "PR.DS-08",
                    "PR.IP-01",
                    "PR.IP-02",
                    "PR.IP-03",
                    "PR.IP-04",
                    "PR.IP-05",
                    "PR.IP-06",
                    "PR.IP-07",
                    "PR.IP-08",
                    "PR.IP-09",
                    "PR.IP-10",
                    "PR.IP-11",
                    "PR.IP-12",
                    "PR.MA-01",
                    "PR.MA-02",
                    "PR.PT-01",
                    "PR.PT-02",
                    "PR.PT-03",
                    "PR.PT-04",
                    "PR.PT-05",
                    "RC.CO-01",
                    "RC.CO-02",
                    "RC.CO-03",
                    "RC.IM-01",
                    "RC.IM-02",
                    "RC.RP-01",
                    "RS.AN-01",
                    "RS.AN-02",
                    "RS.AN-03",
                    "RS.AN-04",
                    "RS.AN-05",
                    "RS.CO-01",
                    "RS.CO-02",
                    "RS.CO-03",
                    "RS.CO-04",
                    "RS.CO-05",
                    "RS.IM-01",
                    "RS.IM-02",
                    "RS.MI-01",
                    "RS.MI-02",
                    "RS.MI-03",
                    "RS.RP-01"
                  ]
                },
                "subcategory_text": {
                  "type": "string"
                },
                "mapping_weight": {
                  "type": "string",
                  "enum": [
                    "ALTO",
                    "MEDIO",
                    "BASSO"
                  ]
                },
                "rationale": {
                  "type": "string"
                }
              }
            }
          },
          "prototype_actions": {
            "type": "array",
            "items": {
              "type": "object",
              "additionalProperties": false,
              "required": [
                "action",
                "subcategory_id",
                "subcategory_text",
                "existing_row",
                "classe",
                "priority",
                "source_reference",
                "rationale"
              ],
              "properties": {
                "action": {
                  "type": "string",
                  "enum": [
                    "new",
                    "modify",
                    "deprecate",
                    "no_change",
                    "review_needed"
                  ]
                },
                "subcategory_id": {
                  "type": "string",
                  "enum": [
                    "DE.AE-01",
                    "DE.AE-02",
                    "DE.AE-03",
                    "DE.AE-04",
                    "DE.AE-05",
                    "DE.CM-01",
                    "DE.CM-02",
                    "DE.CM-03",
                    "DE.CM-04",
                    "DE.CM-05",
                    "DE.CM-06",
                    "DE.CM-07",
                    "DE.CM-08",
                    "DE.DP-01",
                    "DE.DP-02",
                    "DE.DP-03",
                    "DE.DP-04",
                    "DE.DP-05",
                    "DP-ID.AM-07",
                    "DP-ID.AM-08",
                    "DP-ID.DM-01",
                    "DP-ID.DM-02",
                    "DP-ID.DM-03",
                    "DP-ID.DM-04",
                    "DP-ID.DM-05",
                    "DP-ID.RA-07",
                    "DP-RS.CO-06",
                    "ID.AM-01",
                    "ID.AM-02",
                    "ID.AM-03",
                    "ID.AM-04",
                    "ID.AM-05",
                    "ID.AM-06",
                    "ID.BE-01",
                    "ID.BE-02",
                    "ID.BE-03",
                    "ID.BE-04",
                    "ID.BE-05",
                    "ID.GV-01",
                    "ID.GV-02",
                    "ID.GV-03",
                    "ID.GV-04",
                    "ID.RA-01",
                    "ID.RA-02",
                    "ID.RA-03",
                    "ID.RA-04",
                    "ID.RA-05",
                    "ID.RA-06",
                    "ID.RM-01",
                    "ID.RM-02",
                    "ID.RM-03",
                    "ID.SC-01",
                    "ID.SC-02",
                    "ID.SC-03",
                    "ID.SC-04",
                    "ID.SC-05",
                    "PR.AC-01",
                    "PR.AC-02",
                    "PR.AC-03",
                    "PR.AC-04",
                    "PR.AC-05",
                    "PR.AC-06",
                    "PR.AC-07",
                    "PR.AT-01",
                    "PR.AT-02",
                    "PR.AT-03",
                    "PR.AT-04",
                    "PR.AT-05",
                    "PR.DS-01",
                    "PR.DS-02",
                    "PR.DS-03",
                    "PR.DS-04",
                    "PR.DS-05",
                    "PR.DS-06",
                    "PR.DS-07",
                    "PR.DS-08",
                    "PR.IP-01",
                    "PR.IP-02",
                    "PR.IP-03",
                    "PR.IP-04",
                    "PR.IP-05",
                    "PR.IP-06",
                    "PR.IP-07",
                    "PR.IP-08",
                    "PR.IP-09",
                    "PR.IP-10",
                    "PR.IP-11",
                    "PR.IP-12",
                    "PR.MA-01",
                    "PR.MA-02",
                    "PR.PT-01",
                    "PR.PT-02",
                    "PR.PT-03",
                    "PR.PT-04",
                    "PR.PT-05",
                    "RC.CO-01",
                    "RC.CO-02",
                    "RC.CO-03",
                    "RC.IM-01",
                    "RC.IM-02",
                    "RC.RP-01",
                    "RS.AN-01",
                    "RS.AN-02",
                    "RS.AN-03",
                    "RS.AN-04",
                    "RS.AN-05",
                    "RS.CO-01",
                    "RS.CO-02",
                    "RS.CO-03",
                    "RS.CO-04",
                    "RS.CO-05",
                    "RS.IM-01",
                    "RS.IM-02",
                    "RS.MI-01",
                    "RS.MI-02",
                    "RS.MI-03",
                    "RS.RP-01"
                  ]
                },
                "subcategory_text": {
                  "type": "string"
                },
                "existing_row": {
                  "type": [
                    "integer",
                    "null"
                  ]
                },
                "classe": {
                  "type": "string",
                  "enum": [
                    "Obbligatoria",
                    "Consigliata",
                    "Facoltativa",
                    "Non applicabile",
                    "Da verificare"
                  ]
                },
                "priority": {
                  "type": "string",
                  "enum": [
                    "ALTA",
                    "MEDIA",
                    "BASSA",
                    "Non applicabile",
                    "Da verificare"
                  ]
                },
                "source_reference": {
                  "type": [
                    "string",
                    "null"
                  ]
                },
                "rationale": {
                  "type": "string"
                }
              }
            }
          },
          "control_actions": {
            "type": "array",
            "items": {
              "type": "object",
              "additionalProperties": false,
              "required": [
                "action",
                "existing_control_row",
                "existing_control_id",
                "control_text",
                "subcategories_with_weight",
                "references",
                "priority",
                "delegated_to",
                "rationale"
              ],
              "properties": {
                "action": {
                  "type": "string",
                  "enum": [
                    "new",
                    "modify",
                    "deprecate",
                    "no_change",
                    "review_needed"
                  ]
                },
                "existing_control_row": {
                  "type": [
                    "integer",
                    "null"
                  ]
                },
                "existing_control_id": {
                  "type": [
                    "string",
                    "null"
                  ]
                },
                "control_text": {
                  "type": [
                    "string",
                    "null"
                  ]
                },
                "subcategories_with_weight": {
                  "type": [
                    "string",
                    "null"
                  ]
                },
                "references": {
                  "type": [
                    "string",
                    "null"
                  ]
                },
                "priority": {
                  "type": "string",
                  "enum": [
                    "ALTA",
                    "MEDIA",
                    "BASSA",
                    "Non applicabile",
                    "Da verificare"
                  ]
                },
                "delegated_to": {
                  "type": [
                    "string",
                    "null"
                  ]
                },
                "rationale": {
                  "type": "string"
                }
              }
            }
          },
          "notes": {
            "type": [
              "string",
              "null"
            ]
          }
        }
      }
    },
    "merge_summary": {
      "type": "object",
      "additionalProperties": false,
      "required": [
        "relevant_changes",
        "non_relevant_changes",
        "uncertain_changes",
        "new_items",
        "modifications",
        "deprecations",
        "summary"
      ],
      "properties": {
        "relevant_changes": {
          "type": "integer"
        },
        "non_relevant_changes": {
          "type": "integer"
        },
        "uncertain_changes": {
          "type": "integer"
        },
        "new_items": {
          "type": "integer"
        },
        "modifications": {
          "type": "integer"
        },
        "deprecations": {
          "type": "integer"
        },
        "summary": {
          "type": "string"
        }
      }
    }
  }
}
